[INFO] Scanning for projects...
[INFO] ------------------------------------------------------------------------
[INFO] Reactor Build Order:
[INFO] 
[INFO] JPwH                                                               [pom]
[INFO] Shared                                                             [jar]
[INFO] Environment                                                        [jar]
[INFO] Model                                                              [jar]
[INFO] Examples                                                           [jar]
[INFO] 
[INFO] ---------------------------< org.jpwh:jpwh >----------------------------
[INFO] Building JPwH 1.0-SNAPSHOT                                         [1/5]
[INFO] --------------------------------[ pom ]---------------------------------
[INFO] 
[INFO] --- maven-clean-plugin:2.5:clean (default-clean) @ jpwh ---
[INFO] 
[INFO] --- maven-install-plugin:2.4:install (default-install) @ jpwh ---
[INFO] Installing D:\MyProjects\jpwh-2e-examples-20151103\pom.xml to C:\Users\vvsol\.m2\repository\org\jpwh\jpwh\1.0-SNAPSHOT\jpwh-1.0-SNAPSHOT.pom
[INFO] 
[INFO] --------------------------< org.jpwh:shared >---------------------------
[INFO] Building Shared 1.0-SNAPSHOT                                       [2/5]
[INFO] --------------------------------[ jar ]---------------------------------
[INFO] 
[INFO] --- maven-clean-plugin:2.5:clean (default-clean) @ shared ---
[INFO] Deleting D:\MyProjects\jpwh-2e-examples-20151103\shared\target
[INFO] 
[INFO] --- maven-resources-plugin:2.6:resources (default-resources) @ shared ---
[INFO] Using 'UTF-8' encoding to copy filtered resources.
[INFO] Copying 1 resource
[INFO] 
[INFO] --- maven-compiler-plugin:3.1:compile (default-compile) @ shared ---
[INFO] Changes detected - recompiling the module!
[INFO] Compiling 11 source files to D:\MyProjects\jpwh-2e-examples-20151103\shared\target\classes
[WARNING] /D:/MyProjects/jpwh-2e-examples-20151103/shared/src/main/java/org/jpwh/shared/util/Exceptions.java: Some input files use unchecked or unsafe operations.
[WARNING] /D:/MyProjects/jpwh-2e-examples-20151103/shared/src/main/java/org/jpwh/shared/util/Exceptions.java: Recompile with -Xlint:unchecked for details.
[INFO] 
[INFO] --- maven-resources-plugin:2.6:testResources (default-testResources) @ shared ---
[INFO] Using 'UTF-8' encoding to copy filtered resources.
[INFO] skip non existing resourceDirectory D:\MyProjects\jpwh-2e-examples-20151103\shared\src\test\resources
[INFO] 
[INFO] --- maven-compiler-plugin:3.1:testCompile (default-testCompile) @ shared ---
[INFO] No sources to compile
[INFO] 
[INFO] --- maven-surefire-plugin:2.19.1:test (default-test) @ shared ---
[INFO] Tests are skipped.
[INFO] 
[INFO] --- maven-jar-plugin:2.4:jar (default-jar) @ shared ---
[INFO] Building jar: D:\MyProjects\jpwh-2e-examples-20151103\shared\target\shared-1.0-SNAPSHOT.jar
[INFO] 
[INFO] --- maven-install-plugin:2.4:install (default-install) @ shared ---
[INFO] Installing D:\MyProjects\jpwh-2e-examples-20151103\shared\target\shared-1.0-SNAPSHOT.jar to C:\Users\vvsol\.m2\repository\org\jpwh\shared\1.0-SNAPSHOT\shared-1.0-SNAPSHOT.jar
[INFO] Installing D:\MyProjects\jpwh-2e-examples-20151103\shared\pom.xml to C:\Users\vvsol\.m2\repository\org\jpwh\shared\1.0-SNAPSHOT\shared-1.0-SNAPSHOT.pom
[INFO] 
[INFO] ------------------------< org.jpwh:environment >------------------------
[INFO] Building Environment 1.0-SNAPSHOT                                  [3/5]
[INFO] --------------------------------[ jar ]---------------------------------
[INFO] 
[INFO] --- maven-clean-plugin:2.5:clean (default-clean) @ environment ---
[INFO] Deleting D:\MyProjects\jpwh-2e-examples-20151103\environment\target
[INFO] 
[INFO] --- maven-resources-plugin:2.6:resources (default-resources) @ environment ---
[INFO] Using 'UTF-8' encoding to copy filtered resources.
[INFO] Copying 1 resource
[INFO] 
[INFO] --- maven-compiler-plugin:3.1:compile (default-compile) @ environment ---
[INFO] Changes detected - recompiling the module!
[INFO] Compiling 5 source files to D:\MyProjects\jpwh-2e-examples-20151103\environment\target\classes
[INFO] 
[INFO] --- maven-resources-plugin:2.6:testResources (default-testResources) @ environment ---
[INFO] Using 'UTF-8' encoding to copy filtered resources.
[INFO] skip non existing resourceDirectory D:\MyProjects\jpwh-2e-examples-20151103\environment\src\test\resources
[INFO] 
[INFO] --- maven-compiler-plugin:3.1:testCompile (default-testCompile) @ environment ---
[INFO] No sources to compile
[INFO] 
[INFO] --- maven-surefire-plugin:2.19.1:test (default-test) @ environment ---
[INFO] Tests are skipped.
[INFO] 
[INFO] --- maven-jar-plugin:2.4:jar (default-jar) @ environment ---
[INFO] Building jar: D:\MyProjects\jpwh-2e-examples-20151103\environment\target\environment-1.0-SNAPSHOT.jar
[INFO] 
[INFO] --- maven-install-plugin:2.4:install (default-install) @ environment ---
[INFO] Installing D:\MyProjects\jpwh-2e-examples-20151103\environment\target\environment-1.0-SNAPSHOT.jar to C:\Users\vvsol\.m2\repository\org\jpwh\environment\1.0-SNAPSHOT\environment-1.0-SNAPSHOT.jar
[INFO] Installing D:\MyProjects\jpwh-2e-examples-20151103\environment\pom.xml to C:\Users\vvsol\.m2\repository\org\jpwh\environment\1.0-SNAPSHOT\environment-1.0-SNAPSHOT.pom
[INFO] 
[INFO] ---------------------------< org.jpwh:model >---------------------------
[INFO] Building Model 1.0-SNAPSHOT                                        [4/5]
[INFO] --------------------------------[ jar ]---------------------------------
[INFO] 
[INFO] --- maven-clean-plugin:2.5:clean (default-clean) @ model ---
[INFO] Deleting D:\MyProjects\jpwh-2e-examples-20151103\model\target
[INFO] 
[INFO] --- maven-resources-plugin:2.6:resources (default-resources) @ model ---
[INFO] Using 'UTF-8' encoding to copy filtered resources.
[INFO] Copying 35 resources
[INFO] 
[INFO] --- maven-compiler-plugin:3.1:compile (default-compile) @ model ---
[INFO] Changes detected - recompiling the module!
[INFO] Compiling 236 source files to D:\MyProjects\jpwh-2e-examples-20151103\model\target\classes
[INFO] 
[INFO] >>> hibernate-enhance-maven-plugin:5.0.1.Final:enhance (default) > compile @ model >>>
[INFO] 
[INFO] --- maven-resources-plugin:2.6:resources (default-resources) @ model ---
[INFO] Using 'UTF-8' encoding to copy filtered resources.
[INFO] Copying 35 resources
[INFO] 
[INFO] --- maven-compiler-plugin:3.1:compile (default-compile) @ model ---
[INFO] Nothing to compile - all classes are up to date
[INFO] 
[INFO] <<< hibernate-enhance-maven-plugin:5.0.1.Final:enhance (default) < compile @ model <<<
[INFO] 
[INFO] 
[INFO] --- hibernate-enhance-maven-plugin:5.0.1.Final:enhance (default) @ model ---
[INFO] 
[INFO] --- maven-resources-plugin:2.6:testResources (default-testResources) @ model ---
[INFO] Using 'UTF-8' encoding to copy filtered resources.
[INFO] skip non existing resourceDirectory D:\MyProjects\jpwh-2e-examples-20151103\model\src\test\resources
[INFO] 
[INFO] --- maven-compiler-plugin:3.1:testCompile (default-testCompile) @ model ---
[INFO] No sources to compile
[INFO] 
[INFO] --- maven-surefire-plugin:2.19.1:test (default-test) @ model ---
[INFO] Tests are skipped.
[INFO] 
[INFO] --- maven-jar-plugin:2.4:jar (default-jar) @ model ---
[INFO] Building jar: D:\MyProjects\jpwh-2e-examples-20151103\model\target\model-1.0-SNAPSHOT.jar
[INFO] 
[INFO] --- maven-install-plugin:2.4:install (default-install) @ model ---
[INFO] Installing D:\MyProjects\jpwh-2e-examples-20151103\model\target\model-1.0-SNAPSHOT.jar to C:\Users\vvsol\.m2\repository\org\jpwh\model\1.0-SNAPSHOT\model-1.0-SNAPSHOT.jar
[INFO] Installing D:\MyProjects\jpwh-2e-examples-20151103\model\pom.xml to C:\Users\vvsol\.m2\repository\org\jpwh\model\1.0-SNAPSHOT\model-1.0-SNAPSHOT.pom
[INFO] 
[INFO] -------------------------< org.jpwh:examples >--------------------------
[INFO] Building Examples 1.0-SNAPSHOT                                     [5/5]
[INFO] --------------------------------[ jar ]---------------------------------
[INFO] 
[INFO] --- maven-clean-plugin:2.5:clean (default-clean) @ examples ---
[INFO] Deleting D:\MyProjects\jpwh-2e-examples-20151103\examples\target
[INFO] 
[INFO] --- maven-resources-plugin:2.6:resources (default-resources) @ examples ---
[INFO] Using 'UTF-8' encoding to copy filtered resources.
[INFO] skip non existing resourceDirectory D:\MyProjects\jpwh-2e-examples-20151103\examples\src\main\resources
[INFO] 
[INFO] --- maven-compiler-plugin:3.1:compile (default-compile) @ examples ---
[INFO] No sources to compile
[INFO] 
[INFO] --- maven-resources-plugin:2.6:testResources (default-testResources) @ examples ---
[INFO] Using 'UTF-8' encoding to copy filtered resources.
[INFO] skip non existing resourceDirectory D:\MyProjects\jpwh-2e-examples-20151103\examples\src\test\resources
[INFO] 
[INFO] --- maven-compiler-plugin:3.1:testCompile (default-testCompile) @ examples ---
[INFO] Changes detected - recompiling the module!
[INFO] Compiling 131 source files to D:\MyProjects\jpwh-2e-examples-20151103\examples\target\test-classes
[WARNING] /D:/MyProjects/jpwh-2e-examples-20151103/examples/src/test/java/org/jpwh/test/concurrency/Versioning.java: D:\MyProjects\jpwh-2e-examples-20151103\examples\src\test\java\org\jpwh\test\concurrency\Versioning.java uses or overrides a deprecated API.
[WARNING] /D:/MyProjects/jpwh-2e-examples-20151103/examples/src/test/java/org/jpwh/test/concurrency/Versioning.java: Recompile with -Xlint:deprecation for details.
[WARNING] /D:/MyProjects/jpwh-2e-examples-20151103/examples/src/test/java/org/jpwh/test/simple/CRUD.java: Some input files use unchecked or unsafe operations.
[WARNING] /D:/MyProjects/jpwh-2e-examples-20151103/examples/src/test/java/org/jpwh/test/simple/CRUD.java: Recompile with -Xlint:unchecked for details.
[INFO] 
[INFO] --- maven-surefire-plugin:2.19.1:test (default-test) @ examples ---

-------------------------------------------------------
 T E S T S
-------------------------------------------------------
Running TestSuite
Tests run: 216, Failures: 3, Errors: 0, Skipped: 0, Time elapsed: 65.311 sec <<< FAILURE! - in TestSuite
storeLoadLastModified(org.jpwh.test.advanced.GeneratedProperties)  Time elapsed: 0 sec  <<< FAILURE!
java.lang.AssertionError: expected [true] but found [false]
	at org.jpwh.test.advanced.GeneratedProperties.storeLoadLastModified(GeneratedProperties.java:67)

firstCommitWins(org.jpwh.test.concurrency.VersioningTimestamp)  Time elapsed: 0 sec  <<< FAILURE!
org.testng.TestException: 

Method VersioningTimestamp.firstCommitWins()[pri:0, instance:org.jpwh.test.concurrency.VersioningTimestamp@a67c67e] should have thrown an exception of class javax.persistence.OptimisticLockException

auditLogging(org.jpwh.test.filtering.Envers)  Time elapsed: 0.047 sec  <<< FAILURE!
java.lang.NullPointerException
	at org.jpwh.test.filtering.Envers.auditLogging(Envers.java:177)


Results :

Failed tests: 
  GeneratedProperties.storeLoadLastModified:67 expected [true] but found [false]
  VersioningTimestamp.firstCommitWins » Test 
Method VersioningTimestamp.firstCo...
  Envers.auditLogging:177 NullPointer

Tests run: 216, Failures: 3, Errors: 0, Skipped: 0

[INFO] ------------------------------------------------------------------------
[INFO] Reactor Summary for JPwH 1.0-SNAPSHOT:
[INFO] 
[INFO] JPwH ............................................... SUCCESS [  0.217 s]
[INFO] Shared ............................................. SUCCESS [  1.250 s]
[INFO] Environment ........................................ SUCCESS [  0.362 s]
[INFO] Model .............................................. SUCCESS [  7.463 s]
[INFO] Examples ........................................... FAILURE [01:08 min]
[INFO] ------------------------------------------------------------------------
[INFO] BUILD FAILURE
[INFO] ------------------------------------------------------------------------
[INFO] Total time:  01:17 min
[INFO] Finished at: 2021-09-11T12:21:56+05:00
[INFO] ------------------------------------------------------------------------
[ERROR] Failed to execute goal org.apache.maven.plugins:maven-surefire-plugin:2.19.1:test (default-test) on project examples: There are test failures.
[ERROR] 
[ERROR] Please refer to D:\MyProjects\jpwh-2e-examples-20151103\examples\target\surefire-reports for the individual test results.
[ERROR] -> [Help 1]
[ERROR] 
[ERROR] To see the full stack trace of the errors, re-run Maven with the -e switch.
[ERROR] Re-run Maven using the -X switch to enable full debug logging.
[ERROR] 
[ERROR] For more information about the errors and possible solutions, please read the following articles:
[ERROR] [Help 1] http://cwiki.apache.org/confluence/display/MAVEN/MojoFailureException
[ERROR] 
[ERROR] After correcting the problems, you can resume the build with the command
[ERROR]   mvn <args> -rf :examples
